{
  "$schema": "https://json-schema.org/draft/2020-12/schema",
  "$id": "https://tesserae.local/schema/plugin.schema.json",
  "title": "Tesserae plugin manifest",
  "description": "Shape of plugin.json. See docs/contracts/plugins.md for the prose contract.",
  "type": "object",
  "required": ["tesserae_compat", "name", "version", "kind", "supports"],
  "properties": {
    "tesserae_compat": {
      "type": "string",
      "pattern": "^\\d+\\.(x|\\d+)(\\..*)?$",
      "description": "Major version range this plugin works against (e.g. '1.x'). The loader rejects mismatches."
    },
    "name": {
      "type": "string",
      "minLength": 1
    },
    "version": {
      "type": "string",
      "pattern": "^\\d+\\.\\d+\\.\\d+(?:[-+].*)?$"
    },
    "kind": {
      "enum": ["widget", "font", "admin", "data"]
    },
    "description": {
      "type": "string"
    },
    "icon": {
      "type": "string",
      "description": "Phosphor icon class (e.g. 'ph-list-checks').",
      "pattern": "^ph-[a-z0-9-]+$"
    },
    "supports": {
      "type": "object",
      "required": ["sizes"],
      "properties": {
        "sizes": {
          "type": "array",
          "items": { "enum": ["xs", "sm", "md", "lg"] },
          "minItems": 1,
          "uniqueItems": true
        },
        "panels": {
          "type": "array",
          "items": { "type": "string" }
        }
      }
    },
    "cell_options": {
      "type": "array",
      "items": {
        "type": "object",
        "required": ["name", "type", "label"],
        "properties": {
          "name": { "type": "string" },
          "type": { "enum": ["string", "textarea", "variables_textarea", "entity_overrides", "location_search", "number", "slider", "select", "multiselect", "boolean", "color"] },
          "label": { "type": "string" },
          "default": {},
          "choices": {
            "type": "array",
            "items": {
              "type": "object",
              "required": ["value", "label"],
              "properties": {
                "value": {},
                "label": { "type": "string" }
              }
            }
          },
          "choices_from": { "type": "string" }
        }
      }
    },
    "settings": {
      "type": "array",
      "items": {
        "type": "object",
        "required": ["name", "type", "label"],
        "properties": {
          "name": { "type": "string" },
          "type": { "type": "string" },
          "label": { "type": "string" },
          "secret": {
            "type": "boolean",
            "description": "When true, this field is saved to settings.json as '<name>_secret' so disk-grepping reveals which values are sensitive."
          },
          "default": {}
        }
      }
    },
    "data_schema": {
      "type": "object",
      "description": "Declares the widget's fetch() data shape so the Panels canvas editor can offer its fields as bindable data sources. Optional: a widget without this block still renders normally but has no bindable fields in the composer. See docs/dev/writing-a-widget.md.",
      "required": ["fields"],
      "properties": {
        "color": {
          "type": "string",
          "description": "Optional accent colour for the widget's card in the composer Data panel."
        },
        "fields": {
          "type": "array",
          "description": "The bindable fields, one per top-level fetch() result key worth exposing.",
          "items": {
            "type": "object",
            "required": ["name", "type"],
            "properties": {
              "name": { "type": "string", "description": "The fetch() result key." },
              "type": {
                "enum": ["num", "str", "arr"],
                "description": "num (number), str (text/state), or arr (list, e.g. a series or item list)."
              },
              "label": { "type": "string", "description": "Human-friendly field name shown in the bind list." },
              "unit": { "type": "string", "description": "Optional unit hint (e.g. 'deg', '%', 's')." }
            }
          }
        },
        "sample": {
          "type": "object",
          "description": "Representative values keyed by field name, matching fetch()'s shape. Powers the editor's live preview and the render fallback when a source isn't configured yet."
        }
      }
    },
    "render": {
      "type": "object",
      "properties": {
        "dither": { "enum": ["none", "floyd-steinberg", "ordered"] },
        "full_bleed": { "type": "boolean" },
        "needs_network": { "type": "boolean" }
      }
    },
    "design": {
      "type": "object",
      "description": "Design-system intent. Default for every field is the strict, palette-safe behaviour; opt-in values signal a widget is using a richer surface and accepts the downstream trade-offs.",
      "properties": {
        "palette": {
          "enum": ["strict", "extended"],
          "default": "strict",
          "description": "`strict` (default): the widget only uses Spectra colour tokens (`--w-orange`, `--w-blue`, etc.), so the rendered output lands cleanly on every supported panel without dithering. `extended`: the widget uses arbitrary CSS colours and relies on the renderer's Floyd-Steinberg pass to approximate them on the panel palette. Good for scenic/decorative widgets (gradients, soft scenery); read worse on BW panels than strict widgets. Catalog reviewers should see this flag and treat extended widgets as taking on the dither-tradeoff responsibility."
        }
      }
    },
    "requires": {
      "type": "array",
      "items": {
        "type": "string",
        "pattern": "^(network|settings|filesystem):[A-Za-z0-9_./*-]+$"
      },
      "uniqueItems": true,
      "description": "Declared capability list. Each entry is `<category>:<value>`. Supported categories: `network:<hostname>` (specific egress target; `network:*` for unrestricted but flagged in review), `settings:plugin` (own plugin settings, the common case; `settings:plugin/<other_id>` for a sibling's; `settings:app` for top-level app settings like lat/lon), `filesystem:write:<path>` (write outside data_dir; reads are implicit for data_dir and the plugin folder). Enforcement in v1: network egress is blocked at the socket layer for hostnames not in the list; settings + filesystem entries are review-only. Widgets without a `requires:` block load with no enforcement (existing behaviour) but should declare in new submissions, the catalog review checklist demands it."
    },
    "fonts": {
      "type": "array",
      "items": {
        "type": "object",
        "required": ["id", "name", "weights", "files"],
        "properties": {
          "id": { "type": "string", "pattern": "^[a-z][a-z0-9_-]*$" },
          "name": { "type": "string", "minLength": 1 },
          "category": { "enum": ["sans", "serif", "mono", "display", "handwriting"] },
          "weights": {
            "type": "array",
            "items": { "type": "integer", "minimum": 100, "maximum": 900 },
            "minItems": 1
          },
          "files": {
            "type": "object",
            "additionalProperties": { "type": "string" }
          }
        }
      }
    }
  }
}
