{
  "tesserae_compat": "1.x",
  "name": "F1 — Race Weekend",
  "version": "0.1.0",
  "kind": "widget",
  "description": "Session schedule for the upcoming F1 race weekend (FP1, FP2, FP3, Sprint where applicable, Qualifying, Race) with circuit silhouette. Times shown in the viewer's local timezone. Data from Jolpica-F1 (no API key).",
  "icon": "ph-calendar-dots",
  "supports": { "sizes": ["sm", "md", "lg"] },
  "render": { "dither": "none", "needs_network": true }
}
