{
  "tesserae_compat": "1.x",
  "name": "GitHub — PR Queue",
  "version": "0.2.0",
  "kind": "widget",
  "description": "Your open PRs + PRs awaiting your review Shows to-review / yours / stale / oldest stats with an honest all-clear state when the queue is empty. Requires a PAT in Plugins → GitHub Core.",
  "icon": "ph-git-pull-request",
  "supports": {
    "sizes": [
      "sm",
      "md",
      "lg"
    ]
  },
  "cell_options": [
    {
      "name": "user",
      "type": "string",
      "label": "Username (blank = github_core default)",
      "default": ""
    },
    {
      "name": "max_results",
      "type": "number",
      "label": "Max PRs per section",
      "default": 6
    }
  ],
  "render": {
    "dither": "none",
    "needs_network": true
  }
}
