{
  "tesserae_compat": "1.x",
  "name": "F1 — Driver Standings",
  "version": "0.1.1",
  "kind": "widget",
  "description": "Current F1 driver championship: position, driver, team, points, wins. Constructor colour stripe on the left of each row. Top 3 shown on xs/sm, top 10 on md, top 20 on lg. Data from Jolpica-F1 (no API key).",
  "icon": "ph-list-numbers",
  "supports": { "sizes": ["xs", "sm", "md", "lg"] },
  "render": { "dither": "none", "needs_network": true }
}
