{
  "tesserae_compat": "1.x",
  "name": "Weather \u2014 Air Quality",
  "version": "0.1.0",
  "kind": "widget",
  "description": "Air Quality Index (European or US scale) plus PM2.5, PM10, O3, NO2 readings. Data from Open-Meteo CAMS (no API key). Colour-coded panel block reflects the AQI band.",
  "icon": "ph-wind",
  "supports": {
    "sizes": [
      "xs",
      "sm",
      "md",
      "lg"
    ]
  },
  "cell_options": [
    {
      "name": "latitude",
      "type": "number",
      "label": "Latitude",
      "default": ""
    },
    {
      "name": "longitude",
      "type": "number",
      "label": "Longitude",
      "default": ""
    },
    {
      "name": "label",
      "type": "string",
      "label": "Place label",
      "default": "Melbourne"
    },
    {
      "name": "scale",
      "type": "select",
      "label": "AQI scale",
      "default": "european",
      "choices": [
        {
          "value": "european",
          "label": "European EAQI (0\u2013100+)"
        },
        {
          "value": "us",
          "label": "US AQI (0\u2013500)"
        }
      ]
    },
    {
      "name": "variant",
      "type": "select",
      "label": "Direction",
      "default": "legacy",
      "choices": [
        {
          "value": "legacy",
          "label": "Legacy"
        },
        {
          "value": "r1",
          "label": "1 \u00b7 Refined"
        },
        {
          "value": "g2",
          "label": "2 \u00b7 Geometric"
        },
        {
          "value": "s3",
          "label": "3 \u00b7 Swiss"
        },
        {
          "value": "d4",
          "label": "4 \u00b7 Data"
        }
      ]
    }
  ],
  "render": {
    "dither": "none",
    "needs_network": true
  }
}
